{
  "$schema": "../schema/cycle-schema.json",
  "cycle": 5,
  "name": "Cycle 5: February 2026",
  "status": "planned",
  "dates": {
    "start": "2026-01-27",
    "end": "2026-02-13",
    "week1": { "start": "2026-01-27", "end": "2026-01-30" },
    "week2": { "start": "2026-02-02", "end": "2026-02-06" },
    "week3": { "start": "2026-02-09", "end": "2026-02-13" }
  },

  "grades": {
    "7": {
      "topic": "Weather & Climate Systems",
      "phenomenon": {
        "week1": "TODO: Define driving phenomenon",
        "week2": "TODO: Define driving phenomenon",
        "week3": "Synthesis & Assessment"
      },
      "ngss": {
        "primary": {
          "code": "MS-ESS2-5",
          "description": "Collect data to provide evidence for how the motions and complex interactions of air masses result in changes in weather conditions."
        },
        "spiral": []
      },
      "threeDimensional": {
        "sep": [],
        "dci": ["ESS2.C: The Roles of Water in Earth's Surface Processes", "ESS2.D: Weather and Climate"],
        "ccc": []
      },
      "misconceptions": [],
      "weeks": {
        "1": { "title": "TODO: Week 1 Title", "status": "not_started" },
        "2": { "title": "TODO: Week 2 Title", "status": "not_started" },
        "3": { "title": "Synthesis & Assessment", "status": "not_started", "isAssessmentWeek": true }
      },
      "materials": {}
    },

    "8": {
      "topic": "Waves & Information Transfer",
      "phenomenon": {
        "week1": "TODO: Define driving phenomenon",
        "week2": "TODO: Define driving phenomenon",
        "week3": "Synthesis & Assessment"
      },
      "ngss": {
        "primary": {
          "code": "MS-PS4-2",
          "description": "Develop and use a model to describe that waves are reflected, absorbed, or transmitted through various materials."
        },
        "spiral": []
      },
      "threeDimensional": {
        "sep": [],
        "dci": ["PS4.A: Wave Properties", "PS4.B: Electromagnetic Radiation"],
        "ccc": []
      },
      "misconceptions": [],
      "weeks": {
        "1": { "title": "TODO: Week 1 Title", "status": "not_started" },
        "2": { "title": "TODO: Week 2 Title", "status": "not_started" },
        "3": { "title": "Synthesis & Assessment", "status": "not_started", "isAssessmentWeek": true }
      },
      "materials": {}
    }
  },

  "analytics": {
    "lastDataPull": null,
    "completionRates": {},
    "averageScores": {},
    "misconceptionFlags": []
  }
}
